{
 "name": "zone_pressure_requests",
 "inputs": [
  {
   "name": "uDam",
   "type": "real",
   "unit": "1",
   "description": "Zone damper position, 0 to 1"
  },
  {
   "name": "VDis_flow",
   "type": "real",
   "unit": "m3/s",
   "description": "Zone airflow"
  },
  {
   "name": "VSet_flow",
   "type": "real",
   "unit": "m3/s",
   "description": "Zone airflow setpoint"
  }
 ],
 "outputs": [
  {
   "name": "yPreReq",
   "type": "int",
   "description": "Static pressure reset requests, 0 to 3"
  }
 ],
 "blocks": [
  {
   "id": "damOpen",
   "class": "Reals.GreaterThreshold",
   "params": [
    {
     "name": "t",
     "value": 0.95
    },
    {
     "name": "h",
     "value": 0.1
    }
   ]
  },
  {
   "id": "served",
   "class": "Reals.GreaterThreshold",
   "params": [
    {
     "name": "t",
     "value": 0.01
    },
    {
     "name": "h",
     "value": 0.005
    }
   ]
  },
  {
   "id": "set1",
   "class": "Reals.MultiplyByParameter",
   "params": [
    {
     "name": "k",
     "value": 0.9
    }
   ]
  },
  {
   "id": "gap1",
   "class": "Reals.Subtract",
   "params": []
  },
  {
   "id": "short1",
   "class": "Reals.GreaterThreshold",
   "params": [
    {
     "name": "t",
     "value": 0.0
    },
    {
     "name": "h",
     "value": 0.01
    }
   ]
  },
  {
   "id": "need1",
   "class": "Logical.And",
   "params": []
  },
  {
   "id": "long1",
   "class": "Logical.TrueDelay",
   "params": [
    {
     "name": "delayTime",
     "value": 120.0
    },
    {
     "name": "delayOnInit",
     "value": true
    }
   ]
  },
  {
   "id": "set2",
   "class": "Reals.MultiplyByParameter",
   "params": [
    {
     "name": "k",
     "value": 0.7
    }
   ]
  },
  {
   "id": "gap2",
   "class": "Reals.Subtract",
   "params": []
  },
  {
   "id": "short2",
   "class": "Reals.GreaterThreshold",
   "params": [
    {
     "name": "t",
     "value": 0.0
    },
    {
     "name": "h",
     "value": 0.01
    }
   ]
  },
  {
   "id": "need2",
   "class": "Logical.And",
   "params": []
  },
  {
   "id": "long2",
   "class": "Logical.TrueDelay",
   "params": [
    {
     "name": "delayTime",
     "value": 120.0
    },
    {
     "name": "delayOnInit",
     "value": true
    }
   ]
  },
  {
   "id": "set3",
   "class": "Reals.MultiplyByParameter",
   "params": [
    {
     "name": "k",
     "value": 0.5
    }
   ]
  },
  {
   "id": "gap3",
   "class": "Reals.Subtract",
   "params": []
  },
  {
   "id": "short3",
   "class": "Reals.GreaterThreshold",
   "params": [
    {
     "name": "t",
     "value": 0.0
    },
    {
     "name": "h",
     "value": 0.01
    }
   ]
  },
  {
   "id": "need3",
   "class": "Logical.And",
   "params": []
  },
  {
   "id": "long3",
   "class": "Logical.TrueDelay",
   "params": [
    {
     "name": "delayTime",
     "value": 120.0
    },
    {
     "name": "delayOnInit",
     "value": true
    }
   ]
  },
  {
   "id": "oneReq",
   "class": "Logical.Or",
   "params": []
  },
  {
   "id": "oneInt",
   "class": "Conversions.BooleanToInteger",
   "params": []
  },
  {
   "id": "two",
   "class": "Integers.Sources.Constant",
   "params": [
    {
     "name": "k",
     "value": 2
    }
   ]
  },
  {
   "id": "three",
   "class": "Integers.Sources.Constant",
   "params": [
    {
     "name": "k",
     "value": 3
    }
   ]
  },
  {
   "id": "req2",
   "class": "Integers.Switch",
   "params": []
  },
  {
   "id": "req3",
   "class": "Integers.Switch",
   "params": []
  }
 ],
 "connections": [
  "uDam -> damOpen.u",
  "VSet_flow -> served.u",
  "VSet_flow -> set1.u",
  "set1.y -> gap1.u1",
  "VDis_flow -> gap1.u2",
  "gap1.y -> short1.u",
  "short1.y -> need1.u1",
  "served.y -> need1.u2",
  "need1.y -> long1.u",
  "VSet_flow -> set2.u",
  "set2.y -> gap2.u1",
  "VDis_flow -> gap2.u2",
  "gap2.y -> short2.u",
  "short2.y -> need2.u1",
  "served.y -> need2.u2",
  "need2.y -> long2.u",
  "VSet_flow -> set3.u",
  "set3.y -> gap3.u1",
  "VDis_flow -> gap3.u2",
  "gap3.y -> short3.u",
  "short3.y -> need3.u1",
  "served.y -> need3.u2",
  "need3.y -> long3.u",
  "long1.y -> oneReq.u1",
  "damOpen.y -> oneReq.u2",
  "oneReq.y -> oneInt.u",
  "two.y -> req2.u1",
  "long2.y -> req2.u2",
  "oneInt.y -> req2.u3",
  "three.y -> req3.u1",
  "long3.y -> req3.u2",
  "req2.y -> req3.u3",
  "req3.y -> yPreReq"
 ]
}
